[
  {
    "case_id": "VAL-DC-001",
    "client_id": "SYN-CL-9001",
    "case_topic": "Дебетовые карты",
    "case_subtopic": "Закрытие счёта",
    "created_at": "2026-07-18T13:10:00+03:00",
    "priority": "high",
    "case_description": "Клиент повторно обращается по вопросу закрытия счёта дебетовой карты. Покупка в сервисе аренды была отменена, деньги доступны, но система продолжает видеть незавершённую карточную операцию и отклоняет закрытие.",
    "conversation_transcript": [
      {
        "speaker": "client",
        "timestamp": "2026-07-18T13:10:00+03:00",
        "text": "Аренду отменили пять дней назад, сумма снова доступна. Мне срочно нужно закрыть карту перед переездом."
      },
      {
        "speaker": "employee",
        "timestamp": "2026-07-18T13:14:00+03:00",
        "text": "Запрос на закрытие вижу, но процессинг всё ещё показывает незавершённую авторизацию. Нужна дополнительная проверка."
      },
      {
        "speaker": "system",
        "timestamp": "2026-07-18T13:15:00+03:00",
        "text": "Автозакрытие отклонено: ACTIVE_AUTHORIZATION_HOLD."
      }
    ],
    "client_context": {
      "segment": "premium",
      "region": "Екатеринбург",
      "relationship_years": 5.6,
      "communication_language": "ru",
      "vulnerability_flags": [
        "relocation_deadline"
      ]
    },
    "products": [
      {
        "product_id": "SYN-CARD-9001",
        "product_type": "debit_card",
        "status": "active",
        "currency": "RUB",
        "balance": 4320,
        "available_balance": 4320,
        "linked_account_id": "SYN-ACC-9001"
      },
      {
        "product_id": "SYN-ACC-9001",
        "product_type": "current_account",
        "status": "closure_requested",
        "currency": "RUB",
        "balance": 4320,
        "available_balance": 4320
      }
    ],
    "synthetic_system_data": {
      "closure_check_code": "ACTIVE_AUTHORIZATION_HOLD",
      "ledger_balance": 4320,
      "available_balance": 4320,
      "fee_events": [],
      "authorization_events": [
        {
          "authorization_id": "SYN-AUTH-901",
          "amount": 3200,
          "merchant_category": "car_rental",
          "status": "reversal_pending",
          "expires_at": "2026-07-21T23:59:59+03:00"
        }
      ],
      "pending_operations": [
        {
          "operation_id": "SYN-OP-901",
          "type": "authorization_reversal",
          "status": "processing"
        }
      ],
      "restriction_flags": []
    }
  },
  {
    "case_id": "VAL-DC-002",
    "client_id": "SYN-CL-9002",
    "case_topic": "Дебетовые карты",
    "case_subtopic": "Закрытие счёта",
    "created_at": "2026-07-18T14:20:00+03:00",
    "priority": "normal",
    "case_description": "Закрытие счёта отклонено из-за технического минуса после комиссии, начисленной уже после блокировки дебетовой карты. Корректировка комиссии одобрена операционным подразделением, но требуется контрольная проверка.",
    "conversation_transcript": [
      {
        "speaker": "client",
        "timestamp": "2026-07-18T14:20:00+03:00",
        "text": "Я заблокировал карту и вывел деньги, но вижу минус 199 рублей и не могу закрыть счёт."
      },
      {
        "speaker": "employee",
        "timestamp": "2026-07-18T14:24:00+03:00",
        "text": "Комиссия начислена после блокировки. В системе уже есть одобрение технической корректировки, проверим итоговый остаток."
      },
      {
        "speaker": "system",
        "timestamp": "2026-07-18T14:25:00+03:00",
        "text": "Автозакрытие отклонено: ACCOUNT_BALANCE_NOT_ZERO."
      }
    ],
    "client_context": {
      "segment": "mass",
      "region": "Москва",
      "relationship_years": 3.4,
      "communication_language": "ru",
      "vulnerability_flags": []
    },
    "products": [
      {
        "product_id": "SYN-CARD-9002",
        "product_type": "debit_card",
        "status": "blocked_by_client",
        "currency": "RUB",
        "balance": 0,
        "available_balance": 0,
        "linked_account_id": "SYN-ACC-9002"
      },
      {
        "product_id": "SYN-ACC-9002",
        "product_type": "current_account",
        "status": "closure_requested",
        "currency": "RUB",
        "balance": -199,
        "available_balance": 0
      }
    ],
    "synthetic_system_data": {
      "closure_check_code": "ACCOUNT_BALANCE_NOT_ZERO",
      "ledger_balance": -199,
      "available_balance": 0,
      "fee_events": [
        {
          "event_id": "SYN-FEE-902",
          "type": "annual_service_fee",
          "amount": 199,
          "status": "technical_correction_approved"
        }
      ],
      "authorization_events": [],
      "pending_operations": [],
      "restriction_flags": []
    }
  },
  {
    "case_id": "VAL-DC-003",
    "client_id": "SYN-CL-9003",
    "case_topic": "Дебетовые карты",
    "case_subtopic": "Закрытие счёта",
    "created_at": "2026-07-18T15:10:00+03:00",
    "priority": "high",
    "case_description": "Счёт с нулевым остатком нельзя закрыть из-за ограничения по исполнительному документу. В системных данных одновременно присутствуют признаки активного ограничения и неоднозначного юридического основания.",
    "conversation_transcript": [
      {
        "speaker": "client",
        "timestamp": "2026-07-18T15:10:00+03:00",
        "text": "Денег на счёте нет, но закрытие недоступно. Документ об ограничении мне неизвестен."
      },
      {
        "speaker": "employee",
        "timestamp": "2026-07-18T15:14:00+03:00",
        "text": "По счёту есть внешний запрет с неоднозначным основанием. Нужна проверка комплаенса и юридического подразделения."
      },
      {
        "speaker": "system",
        "timestamp": "2026-07-18T15:15:00+03:00",
        "text": "Автозакрытие отклонено: ACTIVE_ACCOUNT_RESTRICTION."
      }
    ],
    "client_context": {
      "segment": "mass",
      "region": "Казань",
      "relationship_years": 1.8,
      "communication_language": "ru",
      "vulnerability_flags": []
    },
    "products": [
      {
        "product_id": "SYN-CARD-9003",
        "product_type": "debit_card",
        "status": "expired",
        "currency": "RUB",
        "balance": 0,
        "available_balance": 0,
        "linked_account_id": "SYN-ACC-9003"
      },
      {
        "product_id": "SYN-ACC-9003",
        "product_type": "current_account",
        "status": "restricted",
        "currency": "RUB",
        "balance": 0,
        "available_balance": 0
      }
    ],
    "synthetic_system_data": {
      "closure_check_code": "ACTIVE_ACCOUNT_RESTRICTION",
      "ledger_balance": 0,
      "available_balance": 0,
      "fee_events": [],
      "authorization_events": [],
      "pending_operations": [],
      "restriction_flags": [
        "enforcement_hold",
        "legal_basis_ambiguous"
      ],
      "restriction_reference": "SYN-ENF-2026-903",
      "restriction_status": "ambiguous_legal_basis"
    }
  },
  {
    "case_id": "VAL-DC-004",
    "client_id": "SYN-CL-9004",
    "case_topic": "Дебетовые карты",
    "case_subtopic": "Закрытие счёта",
    "created_at": "2026-07-18T16:00:00+03:00",
    "priority": "normal",
    "case_description": "Закрытие нулевого дебетового счёта отклонено из-за ограничения. Выгрузка содержит статус и флаг ограничения, но обязательный номер документа отсутствует, поэтому проверку основания выполнить нельзя.",
    "conversation_transcript": [
      {
        "speaker": "client",
        "timestamp": "2026-07-18T16:00:00+03:00",
        "text": "Приложение не объясняет, почему нулевой счёт нельзя закрыть. Подскажите, какой документ это блокирует."
      },
      {
        "speaker": "employee",
        "timestamp": "2026-07-18T16:05:00+03:00",
        "text": "В выгрузке есть флаг ограничения, но отсутствует его регистрационный номер. Сначала нужно запросить недостающие сведения."
      },
      {
        "speaker": "system",
        "timestamp": "2026-07-18T16:06:00+03:00",
        "text": "Автозакрытие отклонено: ACTIVE_ACCOUNT_RESTRICTION; restriction_reference отсутствует."
      }
    ],
    "client_context": {
      "segment": "mass",
      "region": "Самара",
      "relationship_years": 2.7,
      "communication_language": "ru",
      "vulnerability_flags": []
    },
    "products": [
      {
        "product_id": "SYN-CARD-9004",
        "product_type": "debit_card",
        "status": "inactive",
        "currency": "RUB",
        "balance": 0,
        "available_balance": 0,
        "linked_account_id": "SYN-ACC-9004"
      },
      {
        "product_id": "SYN-ACC-9004",
        "product_type": "current_account",
        "status": "restricted",
        "currency": "RUB",
        "balance": 0,
        "available_balance": 0
      }
    ],
    "synthetic_system_data": {
      "closure_check_code": "ACTIVE_ACCOUNT_RESTRICTION",
      "ledger_balance": 0,
      "available_balance": 0,
      "fee_events": [],
      "authorization_events": [],
      "pending_operations": [],
      "restriction_flags": [
        "enforcement_hold"
      ],
      "restriction_status": "active"
    }
  },
  {
    "case_id": "VAL-DC-005",
    "client_id": "SYN-CL-9105",
    "case_topic": "Дебетовые карты",
    "case_subtopic": "Закрытие счёта",
    "created_at": "2026-07-08T12:11:00+03:00",
    "priority": "critical",
    "case_description": "Клиент просит закрыть дебетовый счёт и вывести весь остаток 214 500 рублей, однако на 160 000 рублей действует частичное правовое ограничение с недоступными сотруднику деталями.",
    "conversation_transcript": [
      {
        "speaker": "client",
        "timestamp": "2026-07-08T12:11:00+03:00",
        "text": "Закройте счёт и переведите все деньги в другой банк. Я не понимаю, почему часть суммы недоступна."
      },
      {
        "speaker": "employee",
        "timestamp": "2026-07-08T12:16:00+03:00",
        "text": "Вижу частичное ограничение, но его основание и точный объём полномочий в моём интерфейсе не раскрыты."
      },
      {
        "speaker": "system",